{
  "family": "redline-split",
  "generated_at": "2026-07-13T08:23:15Z",
  "manifest": "../../../../../redline-split-ops-jain3-clean-20260713/repos.manifest.toml",
  "manifest_sha256": "6b043a7e2bd8b78011ecd49d85700737e5864d8ebab5cf08ff31ca619901d85f",
  "repositories": [
    {
      "branch": "main",
      "commands": [
        [
          "bash",
          "scripts/ci-local.sh",
          "required"
        ],
        [
          "bash",
          "ops/ci/security.sh"
        ],
        [
          "bash",
          "ops/ci/jankurai-audit.sh"
        ]
      ],
      "commit": "cdb1c5a4d4629ff555cfca9d8994c818e070c571",
      "dependency_artifacts": [],
      "failure": null,
      "forge_main": "cdb1c5a4d4629ff555cfca9d8994c818e070c571",
      "log": "redline-family-ci-pre-jain3-tag.d/redline.log",
      "log_sha256": "51bc55582f4b07cfd80959321a1ab3483df50c5894592d8f3d044fd2afbb5b6e",
      "name": "redline",
      "origin": "http://127.0.0.1:8787/git/jeryu/redlineDB.git",
      "path": "../redline-split/redline",
      "product_version": "4.1.0",
      "protection_policy": "immutable-main-v1",
      "release_checksum_sha256": "13c0ed0f2bf25cd4eb99cd141155a67b0c01c10564e9557d076d071a0eb1bd82",
      "release_commit": "cdb1c5a4d4629ff555cfca9d8994c818e070c571",
      "required_check": "redline/required",
      "status": "pass",
      "tag": "redline-v4.1.0-jain.2",
      "tag_metadata": {
        "commit": "cdb1c5a4d4629ff555cfca9d8994c818e070c571",
        "object": "cdb1c5a4d4629ff555cfca9d8994c818e070c571",
        "object_type": "commit",
        "remote_commit": null,
        "remote_object": "cdb1c5a4d4629ff555cfca9d8994c818e070c571",
        "subject": "release(redline): bind corrective hub version",
        "tagger_date": null
      },
      "tag_revision": 2,
      "tag_state": "verified"
    },
    {
      "branch": "main",
      "commands": [
        [
          "bash",
          "scripts/ci-local.sh",
          "all"
        ]
      ],
      "commit": "2f9fbd72317691dada58d8b6ca64241822540e72",
      "dependency_artifacts": [
        {
          "artifact": "redline-testing-1.0.1-linux-x86_64.tar.gz",
          "artifact_sha256": "6442f06e1acec228acd4ddbbfbbc7a71c271d0d85e8d869a9e81d9a6635127ef",
          "binary_sha256": "61d4b4911375d7b8249d3725dd81342f6d73e61a5e97164b9cee7022071789d4",
          "build_command": [
            "bash",
            "scripts/ci-local.sh",
            "release"
          ],
          "build_log": "redline-family-ci-pre-jain3-tag.d/redline-testing-artifact.log",
          "build_log_sha256": "779109cfc3636c93a7f14a0ad6e4653daa9d5dae3eacdf5965637b8e2978db9f",
          "checksum_sha256": "fd2928ef4b74c087760e6e04fa317e8250f7cace21bceac6c4e81c4399650d38",
          "name": "redline-testing-release",
          "product_version": "1.0.1",
          "release_manifest": "release-manifest.json",
          "release_manifest_sha256": "9857bc44ec6f01b0fb2a0b1dfdd68cfce39919f0fa98295419d8beccc2c84041",
          "release_tag": "redline-testing-v1.0.1-jain.1",
          "source_commit": "4a449d8de05c8a0ced5cb2d29c76e4718a0041ea",
          "source_repo": "redline-testing",
          "source_tree_checksum_sha256": "825c8322794796edd7c9d8aab77438ae64549ea8ee2bf9d08bf698daeca30fac",
          "tag_revision": 1,
          "transport": "file"
        }
      ],
      "failure": null,
      "forge_main": "2f9fbd72317691dada58d8b6ca64241822540e72",
      "log": "redline-family-ci-pre-jain3-tag.d/redline-core.log",
      "log_sha256": "a734d40137a0863b5d413c540b5717f282581d546d468f63187ac08ef928bfa1",
      "name": "redline-core",
      "origin": "http://127.0.0.1:8787/git/jeryu/redline-core.git",
      "path": "../redline-split/redline-core",
      "product_version": "4.1.0",
      "protection_policy": "immutable-main-v1",
      "release_checksum_sha256": "7057e6800620d86ab89973f91b6bdb35a5d7a7f5b6bedbdf2d8e3e0624cde51b",
      "release_commit": "2f9fbd72317691dada58d8b6ca64241822540e72",
      "required_check": "redline-core/required",
      "status": "pass",
      "tag": "redline-core-v4.1.0-jain.3",
      "tag_metadata": null,
      "tag_revision": 3,
      "tag_state": "absent"
    },
    {
      "branch": "main",
      "commands": [
        [
          "bash",
          "scripts/ci-local.sh",
          "pr-ci"
        ],
        [
          "bash",
          "scripts/ci-local.sh",
          "jankurai"
        ],
        [
          "bash",
          "scripts/ci-local.sh",
          "audit"
        ],
        [
          "bash",
          "scripts/ci-local.sh",
          "release"
        ]
      ],
      "commit": "4a449d8de05c8a0ced5cb2d29c76e4718a0041ea",
      "dependency_artifacts": [],
      "failure": null,
      "forge_main": "4a449d8de05c8a0ced5cb2d29c76e4718a0041ea",
      "log": "redline-family-ci-pre-jain3-tag.d/redline-testing.log",
      "log_sha256": "0461b9f64cccef13c671598f26e90dd5ba40d3e414c0e2ca5ecc2391ab9c4e8b",
      "name": "redline-testing",
      "origin": "http://127.0.0.1:8787/git/jeryu/redline-testing.git",
      "path": "../redline-split/redline-testing",
      "product_version": "1.0.1",
      "protection_policy": "immutable-main-v1",
      "release_checksum_sha256": "825c8322794796edd7c9d8aab77438ae64549ea8ee2bf9d08bf698daeca30fac",
      "release_commit": "4a449d8de05c8a0ced5cb2d29c76e4718a0041ea",
      "required_check": "redline-testing/required",
      "status": "pass",
      "tag": "redline-testing-v1.0.1-jain.1",
      "tag_metadata": {
        "commit": "4a449d8de05c8a0ced5cb2d29c76e4718a0041ea",
        "object": "4a449d8de05c8a0ced5cb2d29c76e4718a0041ea",
        "object_type": "commit",
        "remote_commit": null,
        "remote_object": "4a449d8de05c8a0ced5cb2d29c76e4718a0041ea",
        "subject": "release(testing): bind xtask package identity to v1.0.1",
        "tagger_date": null
      },
      "tag_revision": 1,
      "tag_state": "verified"
    },
    {
      "branch": "main",
      "commands": [
        [
          "bash",
          "scripts/ci-local.sh",
          "pr-ci"
        ]
      ],
      "commit": "09fd93be10238cd85abc164b0b01cf0f681ea304",
      "dependency_artifacts": [],
      "failure": null,
      "forge_main": "09fd93be10238cd85abc164b0b01cf0f681ea304",
      "log": "redline-family-ci-pre-jain3-tag.d/redline-web.log",
      "log_sha256": "9ab31573d4a81dd13ba8f236cd56d4313575f25019ab2f5c85b9da0e2b6a7806",
      "name": "redline-web",
      "origin": "http://127.0.0.1:8787/git/jeryu/redline-web.git",
      "path": "../redline-split/redline-web",
      "product_version": "0.1.0",
      "protection_policy": "immutable-main-v1",
      "release_checksum_sha256": "27fef5fd44ad897dbaa244963312b6861e0c54b951ddb4f645f715fbf417c8a9",
      "release_commit": "09fd93be10238cd85abc164b0b01cf0f681ea304",
      "required_check": "redline-web/required",
      "status": "pass",
      "tag": "redline-web-v0.1.0-jain.1",
      "tag_metadata": {
        "commit": "09fd93be10238cd85abc164b0b01cf0f681ea304",
        "object": "09fd93be10238cd85abc164b0b01cf0f681ea304",
        "object_type": "commit",
        "remote_commit": null,
        "remote_object": "09fd93be10238cd85abc164b0b01cf0f681ea304",
        "subject": "release(redline-web): finish Rust-only corrective candidate",
        "tagger_date": null
      },
      "tag_revision": 1,
      "tag_state": "verified"
    }
  ],
  "schema_version": "redline.family-ci/v1",
  "started_at": "2026-07-13T07:51:47Z",
  "status": "pass",
  "strict_tools": true
}
